{
  "motif_id": "auto_610792fa287d7141ed2c6a5c053b57c0",
  "description": "Auto-discovered 3-node motif, found in 2 algorithms: betti_number_q4, betti_number_q5",
  "source": "bottom_up",
  "tags": [
    "irreducible",
    "auto_discovered"
  ],
  "graph": {
    "nodes": [
      {
        "id": 0,
        "vertex_type": "Z",
        "phase_class": "arbitrary",
        "is_boundary": false
      },
      {
        "id": 1,
        "vertex_type": "Z",
        "phase_class": "arbitrary",
        "is_boundary": false
      },
      {
        "id": 2,
        "vertex_type": "Z",
        "phase_class": "zero",
        "is_boundary": false
      }
    ],
    "links": [
      {
        "source": 0,
        "target": 1,
        "edge_type": "HADAMARD"
      },
      {
        "source": 0,
        "target": 2,
        "edge_type": "HADAMARD"
      }
    ]
  }
}
