{
  "motif_id": "auto_404a1083ce742d80c7e014eaad7db875",
  "description": "Auto-discovered 3-node motif, found in 100 algorithms: amplitude_estimation_q10, amplitude_estimation_q4, amplitude_estimation_q5, amplitude_estimation_q6, amplitude_estimation_q7, amplitude_estimation_q8, amplitude_estimation_q9, bacon_shor_q9, bernstein_vazirani_q10, bernstein_vazirani_q3, bernstein_vazirani_q4, bernstein_vazirani_q5, bernstein_vazirani_q6, bernstein_vazirani_q7, bernstein_vazirani_q8, bernstein_vazirani_q9, betti_number_q10, betti_number_q4, betti_number_q5, betti_number_q6, betti_number_q7, betti_number_q8, betti_number_q9, bit_flip_code_q5, color_code_q7, deutsch_jozsa_q10, deutsch_jozsa_q2, deutsch_jozsa_q3, deutsch_jozsa_q4, deutsch_jozsa_q5, deutsch_jozsa_q6, deutsch_jozsa_q7, deutsch_jozsa_q8, deutsch_jozsa_q9, deutsch_q2, grover_q10, grover_q7, grover_q8, grover_q9, hhl_q4, hhl_q5, phase_flip_code_q5, poisson_solver_q4, poisson_solver_q5, quantum_comparator_q10, quantum_comparator_q5, quantum_comparator_q6, quantum_comparator_q7, quantum_comparator_q8, quantum_comparator_q9, quantum_fingerprinting_q10, quantum_fingerprinting_q4, quantum_fingerprinting_q5, quantum_fingerprinting_q6, quantum_fingerprinting_q7, quantum_fingerprinting_q8, quantum_fingerprinting_q9, quantum_walk_search_q10, quantum_walk_search_q3, quantum_walk_search_q4, quantum_walk_search_q5, quantum_walk_search_q6, quantum_walk_search_q7, quantum_walk_search_q8, quantum_walk_search_q9, random_circuit_sampling_q10, random_circuit_sampling_q3, ripple_carry_adder_q10, ripple_carry_adder_q5, ripple_carry_adder_q6, ripple_carry_adder_q7, ripple_carry_adder_q8, ripple_carry_adder_q9, shor_code_q9, simon_q10, simon_q4, simon_q5, simon_q6, simon_q7, simon_q8, simon_q9, surface_code_patch_q9, toric_code_syndrome_q8, trotter_heisenberg_q10, trotter_heisenberg_q2, trotter_heisenberg_q3, trotter_heisenberg_q4, trotter_heisenberg_q5, trotter_heisenberg_q6, trotter_heisenberg_q7, trotter_heisenberg_q8, trotter_heisenberg_q9, zne_folding_q10, zne_folding_q3, zne_folding_q4, zne_folding_q5, zne_folding_q6, zne_folding_q7, zne_folding_q8, zne_folding_q9",
  "source": "bottom_up",
  "tags": [],
  "graph": {
    "nodes": [
      {
        "id": 0,
        "vertex_type": "Z",
        "phase_class": "zero",
        "is_boundary": false
      },
      {
        "id": 1,
        "vertex_type": "X",
        "phase_class": "zero",
        "is_boundary": false
      },
      {
        "id": 2,
        "vertex_type": "Z",
        "phase_class": "zero",
        "is_boundary": false
      }
    ],
    "links": [
      {
        "source": 0,
        "target": 2,
        "edge_type": "HADAMARD"
      },
      {
        "source": 1,
        "target": 0,
        "edge_type": "SIMPLE"
      }
    ]
  }
}