{
  "motif_id": "iqp_triangle_1t_pendant",
  "description": "Triangle of Z-spiders (one T-like, two phaseless) with a phaseless pendant via Hadamard edges (IQP extended triangle)",
  "source": "bottom_up",
  "tags": [
    "irreducible",
    "auto_discovered"
  ],
  "graph": {
    "nodes": [
      {
        "id": 0,
        "vertex_type": "Z",
        "phase_class": "zero",
        "is_boundary": false
      },
      {
        "id": 1,
        "vertex_type": "Z",
        "phase_class": "zero",
        "is_boundary": false
      },
      {
        "id": 2,
        "vertex_type": "Z",
        "phase_class": "t_like",
        "is_boundary": false
      },
      {
        "id": 3,
        "vertex_type": "Z",
        "phase_class": "zero",
        "is_boundary": false
      }
    ],
    "links": [
      {
        "source": 1,
        "target": 0,
        "edge_type": "HADAMARD"
      },
      {
        "source": 1,
        "target": 2,
        "edge_type": "HADAMARD"
      },
      {
        "source": 2,
        "target": 0,
        "edge_type": "HADAMARD"
      },
      {
        "source": 0,
        "target": 3,
        "edge_type": "HADAMARD"
      }
    ]
  }
}
