{
  "motif_id": "graph_state_star_6",
  "description": "Degree-6 star of phaseless Z-spiders via Hadamard edges (graph state hub)",
  "source": "bottom_up",
  "tags": [
    "irreducible",
    "auto_discovered"
  ],
  "graph": {
    "nodes": [
      {
        "id": 0,
        "vertex_type": "Z",
        "phase_class": "zero",
        "is_boundary": false
      },
      {
        "id": 1,
        "vertex_type": "Z",
        "phase_class": "zero",
        "is_boundary": false
      },
      {
        "id": 2,
        "vertex_type": "Z",
        "phase_class": "zero",
        "is_boundary": false
      },
      {
        "id": 3,
        "vertex_type": "Z",
        "phase_class": "zero",
        "is_boundary": false
      },
      {
        "id": 4,
        "vertex_type": "Z",
        "phase_class": "zero",
        "is_boundary": false
      },
      {
        "id": 5,
        "vertex_type": "Z",
        "phase_class": "zero",
        "is_boundary": false
      },
      {
        "id": 6,
        "vertex_type": "Z",
        "phase_class": "zero",
        "is_boundary": false
      }
    ],
    "links": [
      {
        "source": 4,
        "target": 0,
        "edge_type": "HADAMARD"
      },
      {
        "source": 2,
        "target": 0,
        "edge_type": "HADAMARD"
      },
      {
        "source": 0,
        "target": 1,
        "edge_type": "HADAMARD"
      },
      {
        "source": 0,
        "target": 5,
        "edge_type": "HADAMARD"
      },
      {
        "source": 0,
        "target": 3,
        "edge_type": "HADAMARD"
      },
      {
        "source": 0,
        "target": 6,
        "edge_type": "HADAMARD"
      }
    ]
  }
}
