{
  "motif_id": "iqp_triangle_2t",
  "description": "Three Z-spiders forming a Hadamard-edge triangle with two T-like phases, a 3-qubit clique from IQP sampling circuits",
  "source": "bottom_up",
  "tags": [
    "iqp",
    "t_gate",
    "triangle"
  ],
  "graph": {
    "nodes": [
      {
        "id": 0,
        "vertex_type": "Z",
        "phase_class": "t_like",
        "is_boundary": false
      },
      {
        "id": 1,
        "vertex_type": "Z",
        "phase_class": "t_like",
        "is_boundary": false
      },
      {
        "id": 2,
        "vertex_type": "Z",
        "phase_class": "zero",
        "is_boundary": false
      }
    ],
    "links": [
      {
        "source": 0,
        "target": 2,
        "edge_type": "HADAMARD"
      },
      {
        "source": 0,
        "target": 1,
        "edge_type": "HADAMARD"
      },
      {
        "source": 1,
        "target": 2,
        "edge_type": "HADAMARD"
      }
    ]
  }
}
