{
  "motif_id": "iqp_star_chord_1t",
  "description": "T-like Z-spider hub with three phaseless leaves plus one inter-leaf Hadamard chord (IQP extended star)",
  "source": "bottom_up",
  "tags": [
    "irreducible",
    "auto_discovered"
  ],
  "graph": {
    "nodes": [
      {
        "id": 0,
        "vertex_type": "Z",
        "phase_class": "t_like",
        "is_boundary": false
      },
      {
        "id": 1,
        "vertex_type": "Z",
        "phase_class": "zero",
        "is_boundary": false
      },
      {
        "id": 2,
        "vertex_type": "Z",
        "phase_class": "zero",
        "is_boundary": false
      },
      {
        "id": 3,
        "vertex_type": "Z",
        "phase_class": "zero",
        "is_boundary": false
      }
    ],
    "links": [
      {
        "source": 0,
        "target": 1,
        "edge_type": "HADAMARD"
      },
      {
        "source": 0,
        "target": 2,
        "edge_type": "HADAMARD"
      },
      {
        "source": 0,
        "target": 3,
        "edge_type": "HADAMARD"
      },
      {
        "source": 1,
        "target": 2,
        "edge_type": "HADAMARD"
      }
    ]
  }
}
