{
  "motif_id": "auto_b71107166c6dbf434e12e77ee4a6088a",
  "description": "Auto-discovered 3-node motif, found in 2 algorithms: iqp_sampling_q4, iqp_sampling_q5",
  "source": "bottom_up",
  "tags": [
    "irreducible",
    "auto_discovered"
  ],
  "graph": {
    "nodes": [
      {
        "id": 0,
        "vertex_type": "Z",
        "phase_class": "t_like",
        "is_boundary": false
      },
      {
        "id": 1,
        "vertex_type": "Z",
        "phase_class": "zero",
        "is_boundary": false
      },
      {
        "id": 2,
        "vertex_type": "Z",
        "phase_class": "zero",
        "is_boundary": false
      }
    ],
    "links": [
      {
        "source": 2,
        "target": 0,
        "edge_type": "HADAMARD"
      },
      {
        "source": 0,
        "target": 1,
        "edge_type": "HADAMARD"
      }
    ]
  }
}
