{
  "motif_id": "nbr_3660ff7c311ad431ab4825f3f9df877b",
  "description": "Neighborhood-extracted 3-node motif, found in 86 algorithms: dicke_state_q10, dicke_state_q4, dicke_state_q5, dicke_state_q6, dicke_state_q7, dicke_state_q8, dicke_state_q9, hhl_q10, hhl_q4, hhl_q5, hhl_q6, hhl_q7, hhl_q8, hhl_q9, poisson_solver_q10, poisson_solver_q4, poisson_solver_q5, poisson_solver_q6, poisson_solver_q7, poisson_solver_q8, poisson_solver_q9, qcnn_q10, qcnn_q4, qcnn_q5, qcnn_q6, qcnn_q7, qcnn_q8, qcnn_q9, qgan_generator_q10, qgan_generator_q2, qgan_generator_q3, qgan_generator_q4, qgan_generator_q5, qgan_generator_q6, qgan_generator_q7, qgan_generator_q8, qgan_generator_q9, quantum_autoencoder_q10, quantum_autoencoder_q4, quantum_autoencoder_q5, quantum_autoencoder_q6, quantum_autoencoder_q7, quantum_autoencoder_q8, quantum_autoencoder_q9, quantum_boltzmann_q10, quantum_boltzmann_q4, quantum_boltzmann_q5, quantum_boltzmann_q6, quantum_boltzmann_q7, quantum_boltzmann_q8, quantum_boltzmann_q9, quantum_fisher_info_q10, quantum_fisher_info_q2, quantum_fisher_info_q3, quantum_fisher_info_q4, quantum_fisher_info_q5, quantum_fisher_info_q6, quantum_fisher_info_q7, quantum_fisher_info_q8, quantum_fisher_info_q9, vqls_q10, vqls_q2, vqls_q3, vqls_q4, vqls_q5, vqls_q6, vqls_q7, vqls_q8, vqls_q9, vqs_real_time_q10, vqs_real_time_q2, vqs_real_time_q3, vqs_real_time_q4, vqs_real_time_q5, vqs_real_time_q6, vqs_real_time_q7, vqs_real_time_q8, vqs_real_time_q9, w_state_q10, w_state_q3, w_state_q4, w_state_q5, w_state_q6, w_state_q7, w_state_q8, w_state_q9",
  "source": "neighborhood",
  "tags": [],
  "graph": {
    "nodes": [
      {
        "id": 0,
        "vertex_type": "Z",
        "phase_class": "clifford",
        "is_boundary": false
      },
      {
        "id": 1,
        "vertex_type": "X",
        "phase_class": "arbitrary",
        "is_boundary": false
      },
      {
        "id": 2,
        "vertex_type": "Z",
        "phase_class": "clifford",
        "is_boundary": false
      }
    ],
    "links": [
      {
        "source": 0,
        "target": 1,
        "edge_type": "SIMPLE"
      },
      {
        "source": 1,
        "target": 2,
        "edge_type": "SIMPLE"
      }
    ]
  }
}