{
  "motif_id": "iqp_t_fork_3t",
  "description": "T-like Z-spider hub forking to two T-like leaves via Hadamard edges (IQP triple-rotation path)",
  "source": "bottom_up",
  "tags": [
    "irreducible",
    "auto_discovered"
  ],
  "graph": {
    "nodes": [
      {
        "id": 0,
        "vertex_type": "Z",
        "phase_class": "t_like",
        "is_boundary": false
      },
      {
        "id": 1,
        "vertex_type": "Z",
        "phase_class": "t_like",
        "is_boundary": false
      },
      {
        "id": 2,
        "vertex_type": "Z",
        "phase_class": "t_like",
        "is_boundary": false
      }
    ],
    "links": [
      {
        "source": 1,
        "target": 0,
        "edge_type": "HADAMARD"
      },
      {
        "source": 2,
        "target": 0,
        "edge_type": "HADAMARD"
      }
    ]
  }
}
